PMID,Title,Authors,Citation,First Author,Journal/Book,Publication Year,Create Date,PMCID,NIHMS ID,DOI
"35585202","Co-infection with SARS-CoV-2 Omicron and Delta variants revealed by genomic surveillance","Rockett RJ, Draper J, Gall M, Sim EM, Arnott A, Agius JE, Johnson-Mackinnon J, Fong W, Martinez E, Drew AP, Lee C, Ngo C, Ramsperger M, Ginn AN, Wang Q, Fennell M, Ko D, Hueston L, Kairaitis L, Holmes EC, O'Sullivan MN, Chen SC, Kok J, Dwyer DE, Sintchenko V.","Nat Commun. 2022 May 18;13(1):2745. doi: 10.1038/s41467-022-30518-x.","Rockett RJ","Nat Commun","2022","2022/05/18","PMC9117272","","10.1038/s41467-022-30518-x"
"35528612","Innate Immunity Stimulation during the COVID-19 Pandemic: Challenge by Parvulan","Palmieri B, Manenti A, Galotti F, Vadalà M.","J Immunol Res. 2022 Apr 29;2022:4593598. doi: 10.1155/2022/4593598. eCollection 2022.","Palmieri B","J Immunol Res","2022","2022/05/09","PMC9076318","","10.1155/2022/4593598"
"35458530","Highly Thermotolerant SARS-CoV-2 Vaccine Elicits Neutralising Antibodies against Delta and Omicron in Mice","Jansen van Vuren P, McAuley AJ, Kuiper MJ, Singanallur NB, Bruce MP, Riddell S, Goldie S, Mangalaganesh S, Chahal S, Drew TW, Blasdell KR, Tachedjian M, Caly L, Druce JD, Ahmed S, Khan MS, Malladi SK, Singh R, Pandey S, Varadarajan R, Vasan SS.","Viruses. 2022 Apr 13;14(4):800. doi: 10.3390/v14040800.","Jansen van Vuren P","Viruses","2022","2022/04/23","PMC9031315","","10.3390/v14040800"
"35465948","Increased resistance of SARS-CoV-2 Omicron variant to neutralization by vaccine-elicited and therapeutic antibodies","Tada T, Zhou H, Dcosta BM, Samanovic MI, Chivukula V, Herati RS, Hubbard SR, Mulligan MJ, Landau NR.","EBioMedicine. 2022 Apr;78:103944. doi: 10.1016/j.ebiom.2022.103944.","Tada T","EBioMedicine","2022","2022/04/25","PMC9021600","","10.1016/j.ebiom.2022.103944"
"35142444","Development of Receptor Binding Domain (RBD)-Conjugated Nanoparticle Vaccines with Broad Neutralization against SARS-CoV-2 Delta and Other Variants","Chen R, Zhang X, Yuan Y, Deng X, Wu B, Xi Z, Wang G, Lin Y, Li R, Wang X, Zou F, Liang L, Yan H, Liang C, Li Y, Wu S, Deng J, Zhou M, Zhang X, Li C, Bu X, Peng Y, Ke C, Deng K, He X, Zhang Y, Zhang Z, Pan T, Zhang H.","Adv Sci (Weinh). 2022 Apr;9(11):e2105378. doi: 10.1002/advs.202105378. Epub 2022 Feb 10.","Chen R","Adv Sci (Weinh)","2022","2022/02/10","PMC9008796","","10.1002/advs.202105378"
"35262089","Duration of viable virus shedding in SARS-CoV-2 omicron variant infection","Boucau J, Marino C, Regan J, Uddin R, Choudhary MC, Flynn JP, Chen G, Stuckwisch AM, Mathews J, Liew MY, Singh A, Lipiner T, Kittilson A, Melberg M, Li Y, Gilbert RF, Reynolds Z, Iyer SL, Chamberlin GC, Vyas TD, Goldberg MB, Vyas JM, Li JZ, Lemieux JE, Siedner MJ, Barczak AK.","medRxiv. 2022 Mar 2:2022.03.01.22271582. doi: 10.1101/2022.03.01.22271582. Preprint.","Boucau J","medRxiv","2022","2022/03/09","PMC8902872","","10.1101/2022.03.01.22271582"
"35149556","Glycosite-deleted mRNA of SARS-CoV-2 spike protein as a broad-spectrum vaccine","Wu CY, Cheng CW, Kung CC, Liao KS, Jan JT, Ma C, Wong CH.","Proc Natl Acad Sci U S A. 2022 Mar 1;119(9):e2119995119. doi: 10.1073/pnas.2119995119.","Wu CY","Proc Natl Acad Sci U S A","2022","2022/02/12","PMC8892489","","10.1073/pnas.2119995119"
"35144721","Shorter serial intervals in SARS-CoV-2 cases with Omicron BA.1 variant compared with Delta variant, the Netherlands, 13 to 26 December 2021","Backer JA, Eggink D, Andeweg SP, Veldhuijzen IK, van Maarseveen N, Vermaas K, Vlaemynck B, Schepers R, van den Hof S, Reusken CB, Wallinga J.","Euro Surveill. 2022 Feb;27(6):2200042. doi: 10.2807/1560-7917.ES.2022.27.6.2200042.","Backer JA","Euro Surveill","2022","2022/02/11","PMC8832521","","10.2807/1560-7917.ES.2022.27.6.2200042"
